{
  "schema_version": "startup_opportunity.research_publication_policy.v1",
  "policy_id": "startup_opportunity.g1_2_research_publication",
  "policy_version": "1.0.0",
  "current_schema_bundle_version": "4.0.0",
  "adapters": [
    {
      "envelope_version": "startup_opportunity.artifact_envelope.v1",
      "document_bundle_version": "startup_opportunity.document_bundle.v1",
      "receipt_version": "startup_opportunity.artifact_store_operation.v1",
      "manifest_schema_bundle_version": null,
      "checkpoint_preferred": true,
      "blocked_artifact_types": []
    },
    {
      "envelope_version": "startup_opportunity.artifact_envelope.v2",
      "document_bundle_version": "startup_opportunity.document_bundle.v2",
      "receipt_version": "startup_opportunity.artifact_store_operation.v2",
      "manifest_schema_bundle_version": "2.2.0",
      "checkpoint_preferred": false,
      "blocked_artifact_types": []
    },
    {
      "envelope_version": "startup_opportunity.artifact_envelope.v3",
      "document_bundle_version": "startup_opportunity.document_bundle.v3",
      "receipt_version": "startup_opportunity.artifact_store_operation.v2",
      "manifest_schema_bundle_version": "2.2.0",
      "checkpoint_preferred": true,
      "blocked_artifact_types": []
    },
    {
      "envelope_version": "startup_opportunity.artifact_envelope.v4",
      "document_bundle_version": "startup_opportunity.document_bundle.v4",
      "receipt_version": "startup_opportunity.artifact_store_operation.v3",
      "manifest_schema_bundle_version": "3.0.0",
      "checkpoint_preferred": true,
      "blocked_artifact_types": ["startup_opportunity.concept_evidence_assessment_branch_result.v1"]
    },
    {
      "envelope_version": "startup_opportunity.artifact_envelope.v5",
      "document_bundle_version": "startup_opportunity.document_bundle.v5",
      "receipt_version": "startup_opportunity.artifact_store_operation.v4",
      "manifest_schema_bundle_version": "4.0.0",
      "checkpoint_preferred": true,
      "blocked_artifact_types": []
    }
  ],
  "evidence_contract": {
    "legacy_substrate_record": "startup_opportunity.evidence_store_record.v1",
    "materialized_substrate_record": "startup_opportunity.evidence_store_record.v2",
    "business_evidence": "startup_opportunity.evidence.v1",
    "stable_identity": "canonical_source_content_research_goal_sha256.v2",
    "raw_dedup_identity": "content_sha256.v1",
    "mechanical_fields": [
      "evidence_id",
      "run_id",
      "unit_id",
      "source",
      "source_hash",
      "content_hash",
      "research_goal",
      "raw_content_ref",
      "operation_key",
      "recorded_at"
    ],
    "agent_attested_fields": [
      "source_type",
      "evidence_origin",
      "provenance",
      "source_assessment.independence",
      "source_assessment.biases",
      "evidence_tier",
      "evidence_role",
      "representativeness",
      "valid_as_of",
      "freshness_policy",
      "limitations"
    ]
  },
  "traceability_contract": {
    "direction": "branch_to_insight_to_finding_to_claim_to_evidence",
    "chat_is_artifact": false,
    "completion_message_is_artifact": false
  },
  "task_lifecycle_contract": {
    "task_publication_transition": "pending_to_active",
    "harness_dispatches_agent": false,
    "partial_retry": "fail_closed"
  },
  "branch_status_adapter": {
    "completed": "completed_units",
    "partial": "completed_units",
    "insufficient_evidence": "completed_units",
    "failed": "failed_units",
    "cancelled": "cancelled_units_existing",
    "skipped": "skipped_units_existing",
    "ignored_late": "ignored_late_artifact_refs",
    "superseded_by_scope_change": "superseded_units_existing",
    "superseded_by_adaptation": "superseded_units_existing"
  }
}
